{
  "bundle": {
    "package_id": "scale-v3.2-bcm522-question-assets-bundle-20260826-v1.1.0",
    "path": "/Users/sue/Research/ScienceVision-local-packages/scale-v3.2-bcm522-question-assets-bundle-20260826-v1.1.0"
  },
  "domains": {
    "biology": {
      "by_sub_domain": {
        "bio_collision_overlap_magnitude": [
          "sv-biol-bio_collision_check-0057",
          "sv-biol-bio_collision_check-0108"
        ],
        "bio_collision_pair_distance": [
          "sv-biol-bio_collision_check-0103",
          "sv-biol-bio_collision_check-0107"
        ],
        "bio_component_nonpolymer_inventory": [
          "sv-biol-bio_collision_check-0122",
          "sv-biol-bio_collision_check-0130"
        ],
        "bio_component_polymer_context": [
          "sv-biol-bio_collision_check-0052",
          "sv-biol-bio_collision_check-0068"
        ],
        "bio_docking_component_absence": [
          "sv-biol-bio_docking_plausibility-0053",
          "sv-biol-bio_docking_plausibility-0055"
        ],
        "bio_docking_component_clash": [
          "sv-biol-bio_docking_plausibility-0045",
          "sv-biol-bio_docking_plausibility-0093"
        ],
        "bio_docking_component_contacts": [
          "sv-biol-bio_docking_plausibility-0066",
          "sv-biol-bio_docking_plausibility-0067"
        ],
        "bio_docking_component_coverage": [
          "sv-biol-bio_docking_plausibility-0027",
          "sv-biol-bio_docking_plausibility-0060"
        ],
        "bio_docking_component_nearest_pair": [
          "sv-biol-bio_docking_plausibility-0069",
          "sv-biol-bio_docking_plausibility-0097"
        ],
        "molecular_contact_geometry": [
          "sv-biol-bio_collision_check-0072",
          "sv-biol-bio_collision_check-0127"
        ]
      },
      "count": 20,
      "exposure": {
        "access_track": {
          "drawn": {
            "raw_compute": 20
          },
          "population": {
            "raw_compute": 129
          }
        },
        "difficulty": {
          "drawn": {
            "hard": 10,
            "medium": 10
          },
          "population": {
            "hard": 40,
            "medium": 89
          }
        },
        "has_compute_contract": {
          "drawn": {
            "yes": 20
          },
          "population": {
            "yes": 129
          }
        },
        "mask_present": {
          "drawn": {
            "no": 20
          },
          "population": {
            "no": 129
          }
        },
        "viewer": {
          "drawn": {
            "molstar_deployed": 20
          },
          "population": {
            "molstar_deployed": 129
          }
        },
        "vision_class_code": {
          "drawn": {
            "V2": 10,
            "V3": 10
          },
          "population": {
            "V2": 89,
            "V3": 40
          }
        }
      },
      "id_sha256": "b940d5cdbf12f0574222b60fa18a4d751d12ca2da83f4827acd34faff19b5e71",
      "question_ids": [
        "sv-biol-bio_collision_check-0052",
        "sv-biol-bio_collision_check-0057",
        "sv-biol-bio_collision_check-0068",
        "sv-biol-bio_collision_check-0072",
        "sv-biol-bio_collision_check-0103",
        "sv-biol-bio_collision_check-0107",
        "sv-biol-bio_collision_check-0108",
        "sv-biol-bio_collision_check-0122",
        "sv-biol-bio_collision_check-0127",
        "sv-biol-bio_collision_check-0130",
        "sv-biol-bio_docking_plausibility-0027",
        "sv-biol-bio_docking_plausibility-0045",
        "sv-biol-bio_docking_plausibility-0053",
        "sv-biol-bio_docking_plausibility-0055",
        "sv-biol-bio_docking_plausibility-0060",
        "sv-biol-bio_docking_plausibility-0066",
        "sv-biol-bio_docking_plausibility-0067",
        "sv-biol-bio_docking_plausibility-0069",
        "sv-biol-bio_docking_plausibility-0093",
        "sv-biol-bio_docking_plausibility-0097"
      ],
      "quota": {
        "bio_collision_overlap_magnitude": 2,
        "bio_collision_pair_distance": 2,
        "bio_component_nonpolymer_inventory": 2,
        "bio_component_polymer_context": 2,
        "bio_docking_component_absence": 2,
        "bio_docking_component_clash": 2,
        "bio_docking_component_contacts": 2,
        "bio_docking_component_coverage": 2,
        "bio_docking_component_nearest_pair": 2,
        "molecular_contact_geometry": 2
      },
      "rows": [
        {
          "access_track": "raw_compute",
          "answer_fields": [
            "lobe_nearer_assembly_centre"
          ],
          "compute_packages": [
            "gemmi==0.7.5",
            "numpy==2.5.1"
          ],
          "difficulty": "medium",
          "domain": "biology",
          "forbidden_strategies": [
            "clash_score_api",
            "pdb_contact_table"
          ],
          "has_compute_contract": true,
          "mask_asset": null,
          "mcp_allow_list": [
            "viewer_measure_distance",
            "viewer_rotate",
            "viewer_zoom"
          ],
          "primary_asset": {
            "bytes": 314204,
            "format": "cif",
            "path": "assets/biology/bio_component_polymer_context/crawl_data/biology/rcsb_pdb_mmcif/1A1A.cif",
            "sha256": "06d698350696284fddb4c8376c7cfb4ccdf989c154c4da037340dab14cf73402"
          },
          "question_id": "sv-biol-bio_collision_check-0052",
          "sub_domain": "bio_component_polymer_context",
          "task_id": "sv-biol-bio_collision_check-0052",
          "viewer": "molstar_deployed",
          "vision_class_code": "V2",
          "vision_class_group": "hard_moat"
        },
        {
          "access_track": "raw_compute",
          "answer_fields": [
            "distance_A",
            "vdw_overlap_A"
          ],
          "compute_packages": [
            "gemmi==0.7.5",
            "numpy==2.5.1"
          ],
          "difficulty": "medium",
          "domain": "biology",
          "forbidden_strategies": [
            "clash_score_api",
            "pdb_contact_table"
          ],
          "has_compute_contract": true,
          "mask_asset": null,
          "mcp_allow_list": [
            "viewer_measure_distance",
            "viewer_rotate",
            "viewer_zoom"
          ],
          "primary_asset": {
            "bytes": 179515,
            "format": "cif",
            "path": "assets/biology/bio_collision_overlap_magnitude/crawl_data/biology/rcsb_pdb_mmcif/1A1G.cif",
            "sha256": "76c440138b9b02d045afcfb50b07b6ec1c641e4d52d4afc7b4234819b6d3621b"
          },
          "question_id": "sv-biol-bio_collision_check-0057",
          "sub_domain": "bio_collision_overlap_magnitude",
          "task_id": "sv-biol-bio_collision_check-0057",
          "viewer": "molstar_deployed",
          "vision_class_code": "V2",
          "vision_class_group": "hard_moat"
        },
        {
          "access_track": "raw_compute",
          "answer_fields": [
            "lobe_nearer_assembly_centre"
          ],
          "compute_packages": [
            "gemmi==0.7.5",
            "numpy==2.5.1"
          ],
          "difficulty": "medium",
          "domain": "biology",
          "forbidden_strategies": [
            "clash_score_api",
            "pdb_contact_table"
          ],
          "has_compute_contract": true,
          "mask_asset": null,
          "mcp_allow_list": [
            "viewer_measure_distance",
            "viewer_rotate",
            "viewer_zoom"
          ],
          "primary_asset": {
            "bytes": 615270,
            "format": "cif",
            "path": "assets/biology/bio_component_polymer_context/crawl_data/biology/rcsb_pdb_mmcif/1A31.cif",
            "sha256": "66139f53a302457d64fc604584e330677e6344f415b8b9b72c26a2b3edb4d192"
          },
          "question_id": "sv-biol-bio_collision_check-0068",
          "sub_domain": "bio_component_polymer_context",
          "task_id": "sv-biol-bio_collision_check-0068",
          "viewer": "molstar_deployed",
          "vision_class_code": "V2",
          "vision_class_group": "hard_moat"
        },
        {
          "access_track": "raw_compute",
          "answer_fields": [
            "element_pair",
            "vdw_overlap_A"
          ],
          "compute_packages": [
            "gemmi==0.7.5"
          ],
          "difficulty": "medium",
          "domain": "biology",
          "forbidden_strategies": [
            "clash_score_api",
            "pdb_contact_table"
          ],
          "has_compute_contract": true,
          "mask_asset": null,
          "mcp_allow_list": [
            "viewer_measure_distance",
            "viewer_rotate",
            "viewer_zoom"
          ],
          "primary_asset": {
            "bytes": 49660,
            "format": "cif",
            "path": "assets/biology/molecular_contact_geometry/crawl_data/biology/rcsb_pdb_mmcif/1A3I.cif",
            "sha256": "5ff199341248260b1d916264948356ab1eedfb30b4147973e02ff06a08de399e"
          },
          "question_id": "sv-biol-bio_collision_check-0072",
          "sub_domain": "molecular_contact_geometry",
          "task_id": "sv-biol-bio_collision_check-0072",
          "viewer": "molstar_deployed",
          "vision_class_code": "V2",
          "vision_class_group": "hard_moat"
        },
        {
          "access_track": "raw_compute",
          "answer_fields": [
            "distance_A",
            "threshold_gap_A",
            "threshold_relation"
          ],
          "compute_packages": [
            "gemmi==0.7.5",
            "numpy==2.5.1"
          ],
          "difficulty": "medium",
          "domain": "biology",
          "forbidden_strategies": [
            "clash_score_api",
            "pdb_contact_table"
          ],
          "has_compute_contract": true,
          "mask_asset": null,
          "mcp_allow_list": [
            "viewer_measure_distance",
            "viewer_rotate",
            "viewer_zoom"